{
  "as_of": "2026-10-02",
  "items": [
    {
      "kind": "rank_mover",
      "code": "RANK_MOVER",
      "symbol": "BBCA",
      "params": {
        "from": 5,
        "to": 1,
        "change": 4
      },
      "text_en": "BBCA moved from rank 5 to rank 1."
    }
  ],
  "upcoming": [
    {
      "date": "2026-10-08",
      "symbol": "TLKM",
      "type": "dividend_ex_date"
    }
  ],
  "disclaimer": "Information and analysis only. Not investment advice."
}
